Question,Answer
What services does the dental clinic offer?,"We offer general dentistry, cosmetic procedures, orthodontics, dental implants, and pediatric care."
How can I book an appointment?,"You can book an appointment through our website, mobile app, or by calling our clinic."
What are the clinic's working hours?,"Our clinic is open from 9 AM to 6 PM, Monday to Saturday."
Do you accept dental insurance?,"Yes, we accept most major dental insurance plans. Please contact us for specific coverage details."
How can I reschedule or cancel my appointment?,You can reschedule or cancel your appointment through the app or by calling our front desk.
What should I do in case of a dental emergency?,Call our emergency number or visit the clinic immediately. We prioritize emergency cases.
Is my personal health information secure?,"Yes, we comply with HIPAA regulations to ensure your data is safe and secure."
Do you offer teeth whitening services?,"Yes, we offer both in-office and take-home teeth whitening options."
Can I get a cost estimate before treatment?,"Yes, after an initial consultation, we provide a detailed treatment plan with estimated costs."
What should I bring to my first appointment?,"Please bring a valid ID, your insurance card, and any previous dental records if available."
Which hospital matches patient's insurance?,"Dentacare hospitals accept a variety of insurance providers including Aetna, Blue Cross, Cigna, and UnitedHealthcare. Please contact your local branch to confirm coverage."
What is the cost of a regular dental check-up?,"The average cost of a routine dental check-up at Dentacare is between $75 and $150, depending on services required and insurance coverage."
How frequent should dental appointments be?,It is recommended to visit your dentist every 6 months for a routine cleaning and check-up.
How to maintain oral hygiene?,"Brush twice a day, floss daily, use mouthwash, and visit your dentist regularly for cleanings and check-ups."
What should I do if I break a tooth?,"Rinse your mouth with warm water, apply a cold compress, and contact Dentacare urgent care immediately."
What causes toothaches or cavities?,"Toothaches and cavities are commonly caused by tooth decay, poor oral hygiene, gum infections, or enamel erosion."
What are common dental conditions and their symptoms?,"Conditions include gingivitis (swollen gums), cavities (tooth pain and sensitivity), and periodontitis (bleeding gums, bad breath)."
Hi,Hello! How can I assist you with your dental needs today?
Hello,Hi there! Do you have a dental question or need to book an appointment?
Hey there,Hey! I'm here to help you with anything dental-related.
Good morning,Good morning! How can I help you with your dental care today?
Good afternoon,Good afternoon! Do you need assistance with a dental service?
Good evening,Good evening! How can I support your dental health today?
Is anyone there?,"Yes, I'm here to help! What would you like to know about your dental health?"
Can you help me?,Of course! Let me know how I can assist you with dental concerns.
Are you a dentist?,"I'm a dental assistant AI, here to guide you with information and help you connect with a real dentist if needed."
Who am I talking to?,You are chatting with your friendly Dental AI Assistant! How can I help?
What can you do?,"I can help you book appointments, answer dental FAQs, and guide you through oral care."
Are you real?,"I’m a virtual assistant powered by AI, here to support your dental care journey."
"Hi, I need some help",Sure! What kind of dental help are you looking for?
"Hello, can I ask a question?",Absolutely! Ask me anything related to dental health or services.
"Hey, I have a dental issue",I’m here for you! Please describe your dental issue.
Greetings,Greetings! How can I assist with your dental needs today?
Yo!,Hey! How can I help you take care of your teeth today?
"Hi there, can you assist?","Yes, I would be happy to help with your dental concerns."
Good day,Good day! Do you need help with something related to dental care?
Howdy!,Howdy! What can I do for your smile today?
